CourseID,CourseName,CourseDescription,CreationDate,Author,Image,Quiz
5,The Complete JavaScript Course 2024: From Zero to Expert!,Learn javascript online and supercharge your web design with this Javascript for beginners training course.,2024-10-03 19:45:10.235,SkillSprints Inc.,https://img-c.udemycdn.com/course/480x270/851712_fc61_6.jpg,"[{'Answer': 'Web development', 'Options': ['Building APIs', 'Web development', 'Machine learning', 'Mobile development'], 'Question': 'What is React primarily used for?'}, {'Answer': 'Virtual DOM', 'Options': ['Real-time database', 'Virtual DOM', 'Server-side rendering', 'Data modeling'], 'Question': 'Which of the following is a key feature of React?'}, {'Answer': 'JavaScript XML', 'Options': ['JavaScript Extension', 'JavaScript XML', 'JavaScript Server', 'None of the above'], 'Question': 'What is JSX?'}, {'Answer': 'useState', 'Options': ['useRef', 'useEffect', 'useState', 'useContext'], 'Question': 'Which hook is used to manage state in functional components?'}, {'Answer': 'To provide a unique identity to list elements', 'Options': ['To control layout', 'To provide a unique identity to list elements', 'To style elements', 'To handle events'], 'Question': ""What is the purpose of the 'key' prop in React lists?""}, {'Answer': 'It re-renders the component', 'Options': ['It reloads the entire page', 'It re-renders the component', 'It only updates the DOM', 'Nothing happens'], 'Question': ""What is the default behavior of React when a component's state changes?""}, {'Answer': ""import React from 'react'"", 'Options': [""import React from 'react'"", ""import ReactJS from 'react'"", ""require('React')"", 'None of the above'], 'Question': 'Which of the following is a correct way to import React?'}, {'Answer': 'A way to pass data to components', 'Options': [""A component's state"", ""A component's method"", 'A way to pass data to components', 'A type of event handler'], 'Question': ""What is a 'prop' in React?""}, {'Answer': 'Both function Component() and const Component = () => {}', 'Options': ['class Component extends React.Component', 'function Component()', 'const Component = () => {}', 'Both function Component() and const Component = () => {}'], 'Question': 'How do you create a functional component in React?'}, {'Answer': 'componentDidMount', 'Options': ['componentDidMount', 'componentWillUnmount', 'componentDidUpdate', 'componentWillMount'], 'Question': 'Which lifecycle method is invoked immediately after a component is mounted?'}, {'Answer': 'For performing side effects in function components', 'Options': ['For handling events', 'For performing side effects in function components', 'For managing component state', 'None of the above'], 'Question': ""What is the use of the 'useEffect' hook in React?""}, {'Answer': 'All of the above', 'Options': ['Using PureComponent', 'Using shouldComponentUpdate', 'Using React.memo', 'All of the above'], 'Question': 'How can you prevent a component from re-rendering in React?'}, {'Answer': ""To update component's state"", 'Options': ['To initialize state', ""To update component's state"", 'To bind events', 'To render JSX'], 'Question': ""What is the purpose of the 'setState' function in React?""}, {'Answer': 'A React element', 'Options': ['JSX', 'HTML', 'A React element', 'A JavaScript object'], 'Question': 'What is the output of React.createElement()?'}, {'Answer': 'It renders JSX to the DOM', 'Options': ['It updates the state', 'It renders JSX to the DOM', 'It handles events', 'None of the above'], 'Question': 'What is the significance of the render() function in a React class component?'}, {'Answer': 'Moving state to the nearest common parent component', 'Options': ['Passing state between child components', 'Moving state to the nearest common parent component', 'Setting state in the parent component', 'Updating the state in all components'], 'Question': ""What does 'lifting state up' mean in React?""}, {'Answer': 'Passing data deeply through the component tree without prop drilling', 'Options': ['Managing state', 'Passing data deeply through the component tree without prop drilling', 'For handling side effects', 'For managing component lifecycle'], 'Question': ""What is React's Context API used for?""}, {'Answer': 'By passing them as attributes in JSX', 'Options': ['componentDidMount', 'render()', 'Props are passed automatically', 'By passing them as attributes in JSX'], 'Question': 'Which method is used to pass props to a child component in React?'}, {'Answer': 'Using defaultProps', 'Options': ['Using defaultProps', 'Inside the render() method', 'Using componentDidMount', 'Using setState'], 'Question': 'How can you define default props for a component in React?'}, {'Answer': 'All of the above', 'Options': ['Changes in state', 'Changes in props', 'Forceful re-render', 'All of the above'], 'Question': 'Which of the following can cause React components to re-render?'}]"
6,Microsoft Azure: From Zero to Hero - The Complete Guide,"Become an Azure Expert! Learn to design and build modern cloud apps from a certified Azure Architect
Bestseller
",2024-10-03 19:52:55.767,Memi Lavi,https://img-b.udemycdn.com/course/480x270/3651110_df59.jpg,"[{'Answer': 'Web development', 'Options': ['Building APIs', 'Web development', 'Machine learning', 'Mobile development'], 'Question': 'What is React primarily used for?'}, {'Answer': 'Virtual DOM', 'Options': ['Real-time database', 'Virtual DOM', 'Server-side rendering', 'Data modeling'], 'Question': 'Which of the following is a key feature of React?'}, {'Answer': 'JavaScript XML', 'Options': ['JavaScript Extension', 'JavaScript XML', 'JavaScript Server', 'None of the above'], 'Question': 'What is JSX?'}, {'Answer': 'useState', 'Options': ['useRef', 'useEffect', 'useState', 'useContext'], 'Question': 'Which hook is used to manage state in functional components?'}, {'Answer': 'To provide a unique identity to list elements', 'Options': ['To control layout', 'To provide a unique identity to list elements', 'To style elements', 'To handle events'], 'Question': ""What is the purpose of the 'key' prop in React lists?""}, {'Answer': 'It re-renders the component', 'Options': ['It reloads the entire page', 'It re-renders the component', 'It only updates the DOM', 'Nothing happens'], 'Question': ""What is the default behavior of React when a component's state changes?""}, {'Answer': ""import React from 'react'"", 'Options': [""import React from 'react'"", ""import ReactJS from 'react'"", ""require('React')"", 'None of the above'], 'Question': 'Which of the following is a correct way to import React?'}, {'Answer': 'A way to pass data to components', 'Options': [""A component's state"", ""A component's method"", 'A way to pass data to components', 'A type of event handler'], 'Question': ""What is a 'prop' in React?""}, {'Answer': 'Both function Component() and const Component = () => {}', 'Options': ['class Component extends React.Component', 'function Component()', 'const Component = () => {}', 'Both function Component() and const Component = () => {}'], 'Question': 'How do you create a functional component in React?'}, {'Answer': 'componentDidMount', 'Options': ['componentDidMount', 'componentWillUnmount', 'componentDidUpdate', 'componentWillMount'], 'Question': 'Which lifecycle method is invoked immediately after a component is mounted?'}, {'Answer': 'For performing side effects in function components', 'Options': ['For handling events', 'For performing side effects in function components', 'For managing component state', 'None of the above'], 'Question': ""What is the use of the 'useEffect' hook in React?""}, {'Answer': 'All of the above', 'Options': ['Using PureComponent', 'Using shouldComponentUpdate', 'Using React.memo', 'All of the above'], 'Question': 'How can you prevent a component from re-rendering in React?'}, {'Answer': ""To update component's state"", 'Options': ['To initialize state', ""To update component's state"", 'To bind events', 'To render JSX'], 'Question': ""What is the purpose of the 'setState' function in React?""}, {'Answer': 'A React element', 'Options': ['JSX', 'HTML', 'A React element', 'A JavaScript object'], 'Question': 'What is the output of React.createElement()?'}, {'Answer': 'It renders JSX to the DOM', 'Options': ['It updates the state', 'It renders JSX to the DOM', 'It handles events', 'None of the above'], 'Question': 'What is the significance of the render() function in a React class component?'}, {'Answer': 'Moving state to the nearest common parent component', 'Options': ['Passing state between child components', 'Moving state to the nearest common parent component', 'Setting state in the parent component', 'Updating the state in all components'], 'Question': ""What does 'lifting state up' mean in React?""}, {'Answer': 'Passing data deeply through the component tree without prop drilling', 'Options': ['Managing state', 'Passing data deeply through the component tree without prop drilling', 'For handling side effects', 'For managing component lifecycle'], 'Question': ""What is React's Context API used for?""}, {'Answer': 'By passing them as attributes in JSX', 'Options': ['componentDidMount', 'render()', 'Props are passed automatically', 'By passing them as attributes in JSX'], 'Question': 'Which method is used to pass props to a child component in React?'}, {'Answer': 'Using defaultProps', 'Options': ['Using defaultProps', 'Inside the render() method', 'Using componentDidMount', 'Using setState'], 'Question': 'How can you define default props for a component in React?'}, {'Answer': 'All of the above', 'Options': ['Changes in state', 'Changes in props', 'Forceful re-render', 'All of the above'], 'Question': 'Which of the following can cause React components to re-render?'}]"
7,Data Science & Machine Learning(Theory+Projects)A-Z 90 HOURS,"Data Science Python-Learn Statistics for Data Science, Machine Learning for Data Science, Deep Learning for Data Science",2024-10-03 19:57:05.816,AI Sciences Team,https://img-c.udemycdn.com/course/480x270/3582994_f8f8_4.jpg,"[{'Answer': 'Web development', 'Options': ['Building APIs', 'Web development', 'Machine learning', 'Mobile development'], 'Question': 'What is React primarily used for?'}, {'Answer': 'Virtual DOM', 'Options': ['Real-time database', 'Virtual DOM', 'Server-side rendering', 'Data modeling'], 'Question': 'Which of the following is a key feature of React?'}, {'Answer': 'JavaScript XML', 'Options': ['JavaScript Extension', 'JavaScript XML', 'JavaScript Server', 'None of the above'], 'Question': 'What is JSX?'}, {'Answer': 'useState', 'Options': ['useRef', 'useEffect', 'useState', 'useContext'], 'Question': 'Which hook is used to manage state in functional components?'}, {'Answer': 'To provide a unique identity to list elements', 'Options': ['To control layout', 'To provide a unique identity to list elements', 'To style elements', 'To handle events'], 'Question': ""What is the purpose of the 'key' prop in React lists?""}, {'Answer': 'It re-renders the component', 'Options': ['It reloads the entire page', 'It re-renders the component', 'It only updates the DOM', 'Nothing happens'], 'Question': ""What is the default behavior of React when a component's state changes?""}, {'Answer': ""import React from 'react'"", 'Options': [""import React from 'react'"", ""import ReactJS from 'react'"", ""require('React')"", 'None of the above'], 'Question': 'Which of the following is a correct way to import React?'}, {'Answer': 'A way to pass data to components', 'Options': [""A component's state"", ""A component's method"", 'A way to pass data to components', 'A type of event handler'], 'Question': ""What is a 'prop' in React?""}, {'Answer': 'Both function Component() and const Component = () => {}', 'Options': ['class Component extends React.Component', 'function Component()', 'const Component = () => {}', 'Both function Component() and const Component = () => {}'], 'Question': 'How do you create a functional component in React?'}, {'Answer': 'componentDidMount', 'Options': ['componentDidMount', 'componentWillUnmount', 'componentDidUpdate', 'componentWillMount'], 'Question': 'Which lifecycle method is invoked immediately after a component is mounted?'}, {'Answer': 'For performing side effects in function components', 'Options': ['For handling events', 'For performing side effects in function components', 'For managing component state', 'None of the above'], 'Question': ""What is the use of the 'useEffect' hook in React?""}, {'Answer': 'All of the above', 'Options': ['Using PureComponent', 'Using shouldComponentUpdate', 'Using React.memo', 'All of the above'], 'Question': 'How can you prevent a component from re-rendering in React?'}, {'Answer': ""To update component's state"", 'Options': ['To initialize state', ""To update component's state"", 'To bind events', 'To render JSX'], 'Question': ""What is the purpose of the 'setState' function in React?""}, {'Answer': 'A React element', 'Options': ['JSX', 'HTML', 'A React element', 'A JavaScript object'], 'Question': 'What is the output of React.createElement()?'}, {'Answer': 'It renders JSX to the DOM', 'Options': ['It updates the state', 'It renders JSX to the DOM', 'It handles events', 'None of the above'], 'Question': 'What is the significance of the render() function in a React class component?'}, {'Answer': 'Moving state to the nearest common parent component', 'Options': ['Passing state between child components', 'Moving state to the nearest common parent component', 'Setting state in the parent component', 'Updating the state in all components'], 'Question': ""What does 'lifting state up' mean in React?""}, {'Answer': 'Passing data deeply through the component tree without prop drilling', 'Options': ['Managing state', 'Passing data deeply through the component tree without prop drilling', 'For handling side effects', 'For managing component lifecycle'], 'Question': ""What is React's Context API used for?""}, {'Answer': 'By passing them as attributes in JSX', 'Options': ['componentDidMount', 'render()', 'Props are passed automatically', 'By passing them as attributes in JSX'], 'Question': 'Which method is used to pass props to a child component in React?'}, {'Answer': 'Using defaultProps', 'Options': ['Using defaultProps', 'Inside the render() method', 'Using componentDidMount', 'Using setState'], 'Question': 'How can you define default props for a component in React?'}, {'Answer': 'All of the above', 'Options': ['Changes in state', 'Changes in props', 'Forceful re-render', 'All of the above'], 'Question': 'Which of the following can cause React components to re-render?'}]"
8,Complete web development course,"Only web development course that you will need. Covers HTML, CSS, Tailwind, Node, React, MongoDB, Prisma, Deployment etc",2024-10-03 20:03:05.782,Hitesh Choudhary,https://img-c.udemycdn.com/course/480x270/6035102_7d1a.jpg,"[{'Answer': 'Web development', 'Options': ['Building APIs', 'Web development', 'Machine learning', 'Mobile development'], 'Question': 'What is React primarily used for?'}, {'Answer': 'Virtual DOM', 'Options': ['Real-time database', 'Virtual DOM', 'Server-side rendering', 'Data modeling'], 'Question': 'Which of the following is a key feature of React?'}, {'Answer': 'JavaScript XML', 'Options': ['JavaScript Extension', 'JavaScript XML', 'JavaScript Server', 'None of the above'], 'Question': 'What is JSX?'}, {'Answer': 'useState', 'Options': ['useRef', 'useEffect', 'useState', 'useContext'], 'Question': 'Which hook is used to manage state in functional components?'}, {'Answer': 'To provide a unique identity to list elements', 'Options': ['To control layout', 'To provide a unique identity to list elements', 'To style elements', 'To handle events'], 'Question': ""What is the purpose of the 'key' prop in React lists?""}, {'Answer': 'It re-renders the component', 'Options': ['It reloads the entire page', 'It re-renders the component', 'It only updates the DOM', 'Nothing happens'], 'Question': ""What is the default behavior of React when a component's state changes?""}, {'Answer': ""import React from 'react'"", 'Options': [""import React from 'react'"", ""import ReactJS from 'react'"", ""require('React')"", 'None of the above'], 'Question': 'Which of the following is a correct way to import React?'}, {'Answer': 'A way to pass data to components', 'Options': [""A component's state"", ""A component's method"", 'A way to pass data to components', 'A type of event handler'], 'Question': ""What is a 'prop' in React?""}, {'Answer': 'Both function Component() and const Component = () => {}', 'Options': ['class Component extends React.Component', 'function Component()', 'const Component = () => {}', 'Both function Component() and const Component = () => {}'], 'Question': 'How do you create a functional component in React?'}, {'Answer': 'componentDidMount', 'Options': ['componentDidMount', 'componentWillUnmount', 'componentDidUpdate', 'componentWillMount'], 'Question': 'Which lifecycle method is invoked immediately after a component is mounted?'}, {'Answer': 'For performing side effects in function components', 'Options': ['For handling events', 'For performing side effects in function components', 'For managing component state', 'None of the above'], 'Question': ""What is the use of the 'useEffect' hook in React?""}, {'Answer': 'All of the above', 'Options': ['Using PureComponent', 'Using shouldComponentUpdate', 'Using React.memo', 'All of the above'], 'Question': 'How can you prevent a component from re-rendering in React?'}, {'Answer': ""To update component's state"", 'Options': ['To initialize state', ""To update component's state"", 'To bind events', 'To render JSX'], 'Question': ""What is the purpose of the 'setState' function in React?""}, {'Answer': 'A React element', 'Options': ['JSX', 'HTML', 'A React element', 'A JavaScript object'], 'Question': 'What is the output of React.createElement()?'}, {'Answer': 'It renders JSX to the DOM', 'Options': ['It updates the state', 'It renders JSX to the DOM', 'It handles events', 'None of the above'], 'Question': 'What is the significance of the render() function in a React class component?'}, {'Answer': 'Moving state to the nearest common parent component', 'Options': ['Passing state between child components', 'Moving state to the nearest common parent component', 'Setting state in the parent component', 'Updating the state in all components'], 'Question': ""What does 'lifting state up' mean in React?""}, {'Answer': 'Passing data deeply through the component tree without prop drilling', 'Options': ['Managing state', 'Passing data deeply through the component tree without prop drilling', 'For handling side effects', 'For managing component lifecycle'], 'Question': ""What is React's Context API used for?""}, {'Answer': 'By passing them as attributes in JSX', 'Options': ['componentDidMount', 'render()', 'Props are passed automatically', 'By passing them as attributes in JSX'], 'Question': 'Which method is used to pass props to a child component in React?'}, {'Answer': 'Using defaultProps', 'Options': ['Using defaultProps', 'Inside the render() method', 'Using componentDidMount', 'Using setState'], 'Question': 'How can you define default props for a component in React?'}, {'Answer': 'All of the above', 'Options': ['Changes in state', 'Changes in props', 'Forceful re-render', 'All of the above'], 'Question': 'Which of the following can cause React components to re-render?'}]"
9,Mastering Next.js - Build Airbnb Clone from Scratch (2024),"Build Airbnb Full-Stack App with Next.js 14+, Typescript, Clerk Auth, Prisma, Supabase, Tailwind, Shadcn-ui, Zod,Vercel",2024-10-03 20:07:26.619,John Smilga,https://img-c.udemycdn.com/course/480x270/5923376_8f4a_8.jpg,"[{'Answer': 'Web development', 'Options': ['Building APIs', 'Web development', 'Machine learning', 'Mobile development'], 'Question': 'What is React primarily used for?'}, {'Answer': 'Virtual DOM', 'Options': ['Real-time database', 'Virtual DOM', 'Server-side rendering', 'Data modeling'], 'Question': 'Which of the following is a key feature of React?'}, {'Answer': 'JavaScript XML', 'Options': ['JavaScript Extension', 'JavaScript XML', 'JavaScript Server', 'None of the above'], 'Question': 'What is JSX?'}, {'Answer': 'useState', 'Options': ['useRef', 'useEffect', 'useState', 'useContext'], 'Question': 'Which hook is used to manage state in functional components?'}, {'Answer': 'To provide a unique identity to list elements', 'Options': ['To control layout', 'To provide a unique identity to list elements', 'To style elements', 'To handle events'], 'Question': ""What is the purpose of the 'key' prop in React lists?""}, {'Answer': 'It re-renders the component', 'Options': ['It reloads the entire page', 'It re-renders the component', 'It only updates the DOM', 'Nothing happens'], 'Question': ""What is the default behavior of React when a component's state changes?""}, {'Answer': ""import React from 'react'"", 'Options': [""import React from 'react'"", ""import ReactJS from 'react'"", ""require('React')"", 'None of the above'], 'Question': 'Which of the following is a correct way to import React?'}, {'Answer': 'A way to pass data to components', 'Options': [""A component's state"", ""A component's method"", 'A way to pass data to components', 'A type of event handler'], 'Question': ""What is a 'prop' in React?""}, {'Answer': 'Both function Component() and const Component = () => {}', 'Options': ['class Component extends React.Component', 'function Component()', 'const Component = () => {}', 'Both function Component() and const Component = () => {}'], 'Question': 'How do you create a functional component in React?'}, {'Answer': 'componentDidMount', 'Options': ['componentDidMount', 'componentWillUnmount', 'componentDidUpdate', 'componentWillMount'], 'Question': 'Which lifecycle method is invoked immediately after a component is mounted?'}, {'Answer': 'For performing side effects in function components', 'Options': ['For handling events', 'For performing side effects in function components', 'For managing component state', 'None of the above'], 'Question': ""What is the use of the 'useEffect' hook in React?""}, {'Answer': 'All of the above', 'Options': ['Using PureComponent', 'Using shouldComponentUpdate', 'Using React.memo', 'All of the above'], 'Question': 'How can you prevent a component from re-rendering in React?'}, {'Answer': ""To update component's state"", 'Options': ['To initialize state', ""To update component's state"", 'To bind events', 'To render JSX'], 'Question': ""What is the purpose of the 'setState' function in React?""}, {'Answer': 'A React element', 'Options': ['JSX', 'HTML', 'A React element', 'A JavaScript object'], 'Question': 'What is the output of React.createElement()?'}, {'Answer': 'It renders JSX to the DOM', 'Options': ['It updates the state', 'It renders JSX to the DOM', 'It handles events', 'None of the above'], 'Question': 'What is the significance of the render() function in a React class component?'}, {'Answer': 'Moving state to the nearest common parent component', 'Options': ['Passing state between child components', 'Moving state to the nearest common parent component', 'Setting state in the parent component', 'Updating the state in all components'], 'Question': ""What does 'lifting state up' mean in React?""}, {'Answer': 'Passing data deeply through the component tree without prop drilling', 'Options': ['Managing state', 'Passing data deeply through the component tree without prop drilling', 'For handling side effects', 'For managing component lifecycle'], 'Question': ""What is React's Context API used for?""}, {'Answer': 'By passing them as attributes in JSX', 'Options': ['componentDidMount', 'render()', 'Props are passed automatically', 'By passing them as attributes in JSX'], 'Question': 'Which method is used to pass props to a child component in React?'}, {'Answer': 'Using defaultProps', 'Options': ['Using defaultProps', 'Inside the render() method', 'Using componentDidMount', 'Using setState'], 'Question': 'How can you define default props for a component in React?'}, {'Answer': 'All of the above', 'Options': ['Changes in state', 'Changes in props', 'Forceful re-render', 'All of the above'], 'Question': 'Which of the following can cause React components to re-render?'}]"
