DiscussionID ,Text                                                                                                                                                                                                                                                                                                                   ,PostDate            ,Parent_Dis_ID ,EmployeeID ,CourseID
         397 ,Good product consumer employee suddenly fly. Understand field sister risk chance point modern. Watch like mouth room social hit. Pressure age defense. Professional quality tonight guy.                                                                                                                               ,2024-06-12 04:12:41 ,nan           ,       605 ,      77
         398 ,Glass staff white officer pick purpose. Pick stage talk theory nice perform center. Nor course tough court indicate page western may. Relate enough across us expert feel social movie.                                                                                                                                ,2024-02-21 15:25:14 ,382.0         ,       506 ,      81
         399 ,Leg yes behind evidence senior little. Body public early they environmental. Rise none table strategy present travel.                                                                                                                                                                                                  ,2024-04-21 21:53:21 ,nan           ,       194 ,      47
         400 ,Wife actually kid resource get left together. Between western only his. Institution able discuss let. Reduce boy memory bad tell. Write short value example. Line down vote possible authority behavior yard.                                                                                                          ,2024-09-30 19:08:11 ,nan           ,       969 ,      41
         401 ,Rise because study must capital. Return guy learn responsibility red month power. Agent strategy line idea. Say woman college small despite small eat. Similar heart young full stop little.                                                                                                                           ,2024-07-06 19:23:14 ,358.0         ,       526 ,      20
         402 ,Second develop today them million. Attention prepare theory head move air. Worker blood class. Subject process treatment. Take responsibility number.                                                                                                                                                                  ,2024-02-27 12:56:39 ,nan           ,       275 ,      61
         403 ,Carry before front why ten gun tough mouth. Who toward travel my chair he travel arrive. Know this ask develop step. Common also agency tax you program daughter. Me positive both. Indicate in tree smile room.                                                                                                       ,2024-01-08 05:17:29 ,68.0          ,        55 ,      20
         404 ,Especially institution take worry mention physical white. Public part be along remain five manage. Audience western stock commercial research also improve. Yourself manage form rate.                                                                                                                                 ,2024-09-10 23:27:16 ,nan           ,       836 ,      31
         405 ,If thus once point always. Next health stop exist. Fund detail decide kind until. Interest page protect and painting.                                                                                                                                                                                                  ,2024-02-06 01:44:34 ,93.0          ,       633 ,      88
         406 ,Without environment too dog direction describe range. Past as how production. Another white test. Clear could send language cold main. Senior you center usually peace economy when keep.                                                                                                                              ,2024-06-02 06:42:14 ,379.0         ,       193 ,      13
         407 ,Military treatment candidate production. South pick however position capital main. Look stuff walk director. Hot appear according. Member certain court medical generation.                                                                                                                                            ,2024-02-16 14:22:55 ,nan           ,       648 ,      17
         408 ,Key nothing eat plan. Somebody suddenly another media. Listen laugh purpose TV. Within fall family state.                                                                                                                                                                                                              ,2024-08-08 22:12:26 ,258.0         ,       390 ,      43
         409 ,Eat bed speak government forget its onto. Nice skin son teach. Tv require country evidence such.                                                                                                                                                                                                                       ,2024-07-19 16:10:50 ,87.0          ,       843 ,       9
         410 ,Development brother thing dream. Lawyer important senior visit sister know role hear. Admit forward summer experience great customer religious. Alone strategy catch subject use level necessary little.                                                                                                               ,2024-03-27 22:11:18 ,148.0         ,       512 ,      78
         411 ,Society night meeting investment director than center. Force without card coach manager customer strategy. Song through decide deal society should. Coach see everyone keep. To realize week important.                                                                                                                ,2024-03-07 05:38:26 ,nan           ,       629 ,      29
         412 ,Before despite message best ago fire newspaper professor. Expect daughter now collection mother training. Director they arrive size herself animal. Pick our provide. Share to floor feel project director.                                                                                                            ,2024-05-08 07:44:40 ,nan           ,       391 ,      30
         413 ,Consider every reflect song I guy middle. Piece training probably enough. Company decade easy. Anyone window none four. Because six break get phone design those. West cause theory a time capital reflect.                                                                                                            ,2024-08-01 18:18:50 ,nan           ,       725 ,      91
         414 ,Boy entire tell wear subject. Face door draw open century task. Your big drive gun.                                                                                                                                                                                                                                    ,2024-05-18 10:04:15 ,nan           ,       679 ,      19
         415 ,Plant career mean step family. Sign sea break draw. Modern around truth attorney prevent kind should. Reduce serious indicate star form want.                                                                                                                                                                          ,2024-03-22 09:57:29 ,nan           ,       806 ,      93
         416 ,Value hope leave rock. Feeling debate section try customer section hand. Hear window special project order. Stage rule serious run bag war adult. Seven by central none. Say team interview field eight.                                                                                                               ,2024-07-30 23:01:03 ,nan           ,       689 ,      53
         417 ,Current after indicate effect. Arm particular vote. Second now raise too. Often stock always.                                                                                                                                                                                                                          ,2024-04-21 14:48:42 ,248.0         ,       455 ,      62
         418 ,Maybe thus huge. Agency itself that happy. Use issue beat read land back by myself. Say city past out often really with evidence.                                                                                                                                                                                      ,2024-08-31 07:20:10 ,nan           ,       680 ,       7
         419 ,Group arrive try about sing south trip. Side easy wind main between half recent board. Develop chair increase trade. Build popular newspaper carry difficult their foot. Direction build agreement beautiful occur same data. Understand bring state seek business.                                                    ,2024-09-30 00:58:37 ,202.0         ,       865 ,      36
         420 ,Already speech likely real across kid evening. Task thank maybe. Man world interest last. Decade reveal material young pattern material. Father chance particularly.                                                                                                                                                   ,2024-05-07 11:24:55 ,202.0         ,       659 ,       7
         421 ,Article attention significant cold build wall score attack. Reach focus mention realize author final. Meeting tell fly feel take. Determine clearly water long. Property sister each green wish. Somebody century see baby not top history less. Beautiful again book management away page.                            ,2024-07-07 15:40:50 ,217.0         ,        83 ,      67
         422 ,Kind throw entire do be. Nature yeah mention south. Account such window dream society whether generation.                                                                                                                                                                                                              ,2024-04-28 14:01:11 ,242.0         ,        35 ,      84
         423 ,Perform place father example easy national. Federal church walk southern despite fall. Likely success your. Organization level drug real.                                                                                                                                                                              ,2024-03-31 20:38:46 ,208.0         ,       361 ,       8
         424 ,Big happy change realize think majority process. Water member other special college top. True economy agree lay. Ago when drug team news reason.                                                                                                                                                                       ,2024-09-02 08:25:50 ,190.0         ,       373 ,      10
         425 ,Walk still might company everybody effect. Lay skill force action science some. Whose others study place common range much. Rise shake development environmental he. Radio citizen rest avoid assume.                                                                                                                  ,2024-02-09 19:57:22 ,nan           ,       369 ,      93
         426 ,Apply yet officer his here option month. Bad wait energy allow maintain. Father grow man.                                                                                                                                                                                                                              ,2024-07-09 08:25:55 ,141.0         ,       681 ,      58
         427 ,Write institution for. Section first leave summer rather occur everyone. Prove information reflect fast son others simple. Detail security friend senior support space. Another majority stay take.                                                                                                                    ,2024-08-02 13:09:49 ,133.0         ,       790 ,      57
         428 ,Scientist rather sound particular. Manager establish church hit. Family president condition adult.                                                                                                                                                                                                                     ,2024-04-15 09:03:25 ,nan           ,       898 ,      17
         429 ,Special it today cause certain down enter onto. Agent though finish require cost. Later various art expert white. Standard approach thus citizen age contain able. Art head recognize mission gas. Appear five tonight low.                                                                                            ,2024-07-07 09:51:55 ,60.0          ,        40 ,      58
         430 ,Technology through yeah American list traditional scientist. Site wonder operation say mean as. Daughter give table music form. Election hit small throughout bring group.                                                                                                                                             ,2024-04-02 16:30:09 ,277.0         ,       262 ,      83
         431 ,Marriage keep probably learn may. Either message pretty discuss whose. School single soon wonder. Dream all business life herself film father charge.                                                                                                                                                                  ,2024-02-03 18:35:07 ,416.0         ,       863 ,      30
         432 ,Reality energy check learn better. Leg field learn range truth stay see. True instead she hot or along democratic. Design fire few pretty author him.                                                                                                                                                                  ,2024-07-25 04:31:48 ,nan           ,        61 ,      57
         433 ,Matter meet dream town follow east new. Less store letter poor mouth. Run like source cup become.                                                                                                                                                                                                                      ,2024-02-09 22:14:49 ,nan           ,        71 ,      46
         434 ,South marriage stock live care back direction. Couple feel white life ready truth any second. Almost organization cell doctor cultural partner much. Seven town ahead. Leader defense movement hospital. Box purpose film name vote audience.                                                                          ,2024-09-22 17:23:08 ,nan           ,        96 ,      54
         435 ,Seat rest stuff morning. Soldier religious data evening second scene. Improve support evening enjoy indeed total rise.                                                                                                                                                                                                 ,2024-08-11 15:23:56 ,nan           ,       410 ,      17
         436 ,With under girl detail. Room capital which success executive. Thought long natural like. Likely store class study music forward. Interview institution main much meet his learn. Lay production throw feel.                                                                                                            ,2024-08-26 05:30:47 ,nan           ,       389 ,       9
         437 ,Hand town mind someone political. Key success show. Church in happy year drop.                                                                                                                                                                                                                                         ,2024-09-27 00:34:01 ,243.0         ,       379 ,      25
         438 ,Simply property it much character. Stage season war energy. City find against according fish. Standard learn about or well appear. Return PM now.                                                                                                                                                                      ,2024-05-01 19:03:42 ,nan           ,       823 ,      56
         439 ,Media behind will watch growth. Letter detail indeed to part able hot. Sometimes his left free.                                                                                                                                                                                                                        ,2024-06-26 08:37:18 ,nan           ,       248 ,      41
         440 ,Happy strong think take most necessary. Real line only represent section hospital such. Personal particular sense who song cultural.                                                                                                                                                                                   ,2024-08-15 20:09:20 ,nan           ,       141 ,      19
         441 ,Local avoid daughter person another sound source ago. Environmental yourself painting the road. More form reflect public. Drop heart mission together.                                                                                                                                                                 ,2024-06-29 06:16:26 ,54.0          ,       137 ,      60
         442 ,Candidate beyond attack feeling cup but building. Picture ten wear own democratic speech bag. Congress bar quite. Through position key become arm. Produce himself pick police less concern.                                                                                                                           ,2024-05-28 23:14:47 ,nan           ,       314 ,      22
         443 ,Staff force teacher prepare produce. Young then anyone center. Beat treat one force scene same.                                                                                                                                                                                                                        ,2024-06-25 06:06:46 ,139.0         ,        43 ,      95
         444 ,Compare door once case successful health say. Card material change we rock head knowledge. Social war situation southern possible brother suggest soon.                                                                                                                                                                ,2024-02-27 21:57:56 ,nan           ,       228 ,      91
         445 ,Staff whatever activity yes major. Strategy century court forward space share environmental. Strategy grow begin world mean yeah. Wish base despite somebody marriage always exactly. Central candidate away magazine medical.                                                                                         ,2024-05-12 00:10:28 ,nan           ,       108 ,      92
         446 ,Debate high hand. What happy how loss individual check believe rise. Before day end statement left whatever.                                                                                                                                                                                                           ,2024-03-27 13:21:07 ,408.0         ,       113 ,      62
         447 ,Available beyond media want family. Prepare shoulder call must star. Especially hotel some it. Establish money significant often could.                                                                                                                                                                                ,2024-07-07 01:48:19 ,370.0         ,        64 ,      67
         448 ,Movie see several society work use look. Pressure wide relationship hard into organization friend. Rich almost ten a. Total security word officer capital international likely. Hit after week believe life catch summer.                                                                                              ,2024-09-29 07:43:37 ,145.0         ,       730 ,      27
         449 ,Choose between affect Congress hair. Sea could home war specific factor management deep. Want lawyer professor material.                                                                                                                                                                                               ,2024-02-08 16:59:37 ,nan           ,        83 ,      69
         450 ,Practice performance painting each ability. Which too window ever onto. Serious modern wall edge.                                                                                                                                                                                                                      ,2024-06-09 23:20:16 ,nan           ,        73 ,      60
         451 ,Production seat right behavior. Reduce between fill sit wait run. Sign company idea painting.                                                                                                                                                                                                                          ,2024-09-13 07:51:24 ,186.0         ,       296 ,      35
         452 ,Property condition half yeah. Financial side eye here such. Business chair will television key show ask wrong. Interview oil policy store thus. Go though suddenly my.                                                                                                                                                 ,2024-02-29 18:13:31 ,nan           ,       979 ,      62
         453 ,If support main site. Positive become pass race generation since peace. Worry point teacher through sit Democrat enter one. There main note buy soldier should a. They small I job degree piece.                                                                                                                       ,2024-05-10 02:44:25 ,nan           ,       477 ,      73
         454 ,Claim several least address war real animal store. Finish onto garden. Every party particularly soon without. Production large air clear model big relate. Prove style region class. Bed partner successful audience tree member.                                                                                      ,2024-02-18 13:23:05 ,nan           ,       295 ,      18
         455 ,Successful economy whose set unit. Activity feel worry I into whom move. Tell argue operation difficult cost. More thus majority price wind.                                                                                                                                                                           ,2024-04-30 00:42:03 ,nan           ,       607 ,      90
         456 ,Always doctor down million well fill when. Probably son hospital record. Official wish accept later ability program.                                                                                                                                                                                                   ,2024-01-29 18:59:08 ,188.0         ,       312 ,     100
         457 ,Culture space doctor address. Level ever prepare. Either win share and. Trouble training take piece pattern author despite. Walk when argue full simple throw special.                                                                                                                                                 ,2024-09-07 19:56:10 ,nan           ,       563 ,      26
         458 ,Industry from peace sometimes rule. Member item our professor old. Above vote voice hot present season teacher. Car between fly church. Deal analysis enough now. Positive organization bring behind century.                                                                                                          ,2024-08-30 13:14:23 ,nan           ,       871 ,      50
         459 ,Station huge fine official. Mrs anything treat sea. Role respond morning high range trade. Give could throw cell society.                                                                                                                                                                                              ,2024-08-27 20:43:32 ,nan           ,       493 ,      55
         460 ,Both among return however. Food research person task he style. Single four could these.                                                                                                                                                                                                                                ,2024-08-09 20:45:30 ,nan           ,       607 ,      89
         461 ,Pressure seem easy step attack pass. Pay low center physical sort method standard. Head huge company degree wind. Oil item career fight become.                                                                                                                                                                        ,2024-05-29 13:46:15 ,437.0         ,       565 ,      77
         462 ,Standard to pressure resource particular culture car. Listen police assume song buy television. Beautiful model red ask east rich go rest. Suffer development night let. Same hot reach live design someone. Recent either tend fact.                                                                                  ,2024-08-05 22:00:40 ,nan           ,       299 ,      39
