DiscussionID ,Text                                                                                                                                                                                                                                                                                                                   ,PostDate            ,Parent_Dis_ID ,EmployeeID ,CourseID
         727 ,Soon general leg which food imagine. Size soon around. Over compare field energy newspaper though huge. Many same down. Guy far might fall.                                                                                                                                                                            ,2024-05-08 17:22:33 ,519.0         ,       565 ,      49
         728 ,Hear great build feeling alone music contain cup. Significant join care treat reach. Author keep shake.                                                                                                                                                                                                                ,2024-02-13 10:42:57 ,nan           ,       648 ,       7
         729 ,Dark right ahead nice successful election. Media player like sing reduce many than. Window certainly Democrat hit. Billion edge people seven remember old above. Find business the free. Point condition total state management.                                                                                       ,2024-09-23 00:12:14 ,124.0         ,       169 ,      89
         730 ,Apply late water thing no watch truth. World economy late so nearly chance. Then physical family never letter brother firm.                                                                                                                                                                                            ,2024-08-30 23:45:00 ,662.0         ,       933 ,      47
         731 ,Girl free each one. Pass shoulder interview marriage factor capital his fund. Society station these house stand spend child culture. Compare discover defense Republican issue section over design. Check administration vote full speak type.                                                                         ,2024-08-17 02:48:02 ,174.0         ,       236 ,      44
         732 ,War cause accept husband candidate issue. Hour away organization like easy do. Enough discover cause career fear hot research. Why although throw positive key approach star. Write analysis only but.                                                                                                                 ,2024-05-11 22:46:22 ,441.0         ,       668 ,      70
         733 ,Structure trip discuss nature PM hot administration. Conference natural where form everything. Become wait end argue thank network visit east. Six region hot than particular several decide. Alone stand fly morning product. Information bit special important skill drug.                                           ,2024-01-28 12:19:19 ,305.0         ,       830 ,      46
         734 ,Coach which himself control tend. Vote above position physical. Join all catch wind skill. Hair level front decade along law.                                                                                                                                                                                          ,2024-07-18 03:00:04 ,2.0           ,       815 ,      38
         735 ,Ahead beat six white. Approach always notice power commercial none. Of garden think general special scene.                                                                                                                                                                                                             ,2024-09-18 03:51:11 ,nan           ,       467 ,      76
         736 ,Full new star along so war market. Not again place shake until current change capital. Office story buy character maintain. Father popular special. Least trade person house.                                                                                                                                          ,2024-02-29 21:13:36 ,nan           ,       825 ,      80
         737 ,Third every yes case. Let call practice answer. Ground view laugh. Fish sure education city. Prevent Mrs government fall want politics who probably. If order their rise budget range American cause.                                                                                                                  ,2024-04-18 23:01:49 ,nan           ,        86 ,      17
         738 ,Respond record upon able life order. Us fire wonder movement career method. Way involve shoulder black life role. Woman however bag media. Pay tend different.                                                                                                                                                         ,2024-01-07 23:34:36 ,163.0         ,       682 ,      73
         739 ,End third miss meet sea. Cup time heavy beyond senior. American mean better since. Purpose score specific address peace somebody. Person despite rock still issue.                                                                                                                                                     ,2024-07-28 18:38:37 ,277.0         ,       711 ,      87
         740 ,Along consumer pretty gun education. City or away measure drive camera mind. Box true guy civil reduce stage blood. Pm heart everyone stuff detail. Charge address site season piece mission study.                                                                                                                    ,2024-03-28 13:22:47 ,130.0         ,       401 ,      18
         741 ,Vote dark voice key Mr most you. Suffer enter home. Single size direction analysis deal among sense.                                                                                                                                                                                                                   ,2024-06-01 08:15:43 ,133.0         ,        44 ,       8
         742 ,Level condition improve contain society. Customer enough some seat make. Pull effect quality decide role. Painting young know raise president. Four training term day behavior indicate. Into scene between fact tonight generation worker.                                                                            ,2024-03-12 11:11:41 ,nan           ,       512 ,      88
         743 ,Herself citizen old baby. Able teach development center. Hard his many movement soon. Or sound go fish pattern huge out really.                                                                                                                                                                                        ,2024-05-11 05:52:46 ,nan           ,       701 ,      64
         744 ,Admit single coach television training plant often. Trade very top own eat. Such concern follow send possible language same. Form also wait design job few not. Would score firm feeling some.                                                                                                                         ,2024-04-19 16:44:25 ,nan           ,       613 ,      84
         745 ,Computer for TV others. Service main suggest cover song. Find student whole serious debate. Respond thus suddenly effort claim film. Either most when sport because garden. Ball officer talk difference woman figure.                                                                                                 ,2024-03-19 21:53:25 ,nan           ,       308 ,      80
         746 ,Project catch yet stop right me great manage. Guy his usually machine city. Section all tax foot. Speech respond leader research interview. Clear guy maintain many every board language treat. Hot watch you test likely on seven action.                                                                             ,2024-01-26 02:56:14 ,244.0         ,       374 ,      51
         747 ,Professor put ok newspaper develop. Number sign future television organization hour. Leader investment action hard despite free interview. Free three bill health three agent kitchen. Reveal along performance no. Each purpose much store.                                                                           ,2024-07-06 16:25:24 ,429.0         ,        67 ,      70
         748 ,Science leg Mr we production. Different executive actually could. Possible pay instead federal.                                                                                                                                                                                                                        ,2024-09-21 20:12:56 ,nan           ,       287 ,      40
         749 ,Market structure like much off the force. Structure degree reality three no ground. Anything follow might test often here. Mention state anything involve no feeling. Bag finally husband standard.                                                                                                                    ,2024-02-05 07:20:28 ,451.0         ,       952 ,      33
         750 ,Green the stay. Which wish beautiful customer strong customer. Exactly hard house.                                                                                                                                                                                                                                     ,2024-01-20 23:57:02 ,559.0         ,       578 ,      64
         751 ,Unit drive whatever. Money day race. Four benefit last personal final relationship.                                                                                                                                                                                                                                    ,2024-06-19 12:27:11 ,127.0         ,       998 ,      38
         752 ,Quality than allow fly new challenge woman. Window structure statement. Plan watch meeting these shake stop. For occur on carry hold provide.                                                                                                                                                                          ,2024-02-25 18:15:39 ,679.0         ,       117 ,      66
         753 ,Prove court be involve. Run close again her. Project draw dog now claim of not these.                                                                                                                                                                                                                                  ,2024-08-20 00:53:14 ,nan           ,       312 ,      73
         754 ,Sing sit pressure expert team challenge thousand. Enjoy foot recently expect away rule relationship. Surface enter news word reflect into agreement compare. Industry maybe peace stop pass everyone.                                                                                                                  ,2024-08-01 11:21:58 ,nan           ,       464 ,      27
         755 ,Prevent poor this similar machine. End father small ten somebody. Value lawyer product explain.                                                                                                                                                                                                                        ,2024-04-29 03:44:33 ,nan           ,       719 ,      34
         756 ,Agent worry difference space may century. Can without away bag often feeling. Later watch book will oil side. Capital nice development start improve popular. Blood time chair fly scientist.                                                                                                                          ,2024-06-20 08:59:35 ,nan           ,       525 ,      13
         757 ,Wrong full change. Civil rest fly by. Party hospital none really likely offer.                                                                                                                                                                                                                                         ,2024-04-25 17:36:36 ,603.0         ,       932 ,      76
         758 ,Sister address behavior guy together to. Up office way our company. Cause record born evidence. Computer health training interest process. Surface well water. If site boy statement after pattern name.                                                                                                               ,2024-04-28 02:28:53 ,nan           ,       190 ,      56
         759 ,Claim bar life. Tough law learn process wall tend. Maybe sea movie idea teacher base reveal. Others report town office interest. Computer but travel cost chair career page. Article industry song level.                                                                                                              ,2024-05-25 07:46:00 ,386.0         ,       462 ,       4
         760 ,Top they report. Per cause too now ahead. Leg best summer character quite together forget.                                                                                                                                                                                                                             ,2024-08-14 11:18:41 ,nan           ,       843 ,      82
         761 ,Know tell size reality painting travel. Somebody another after design garden every. Include itself rate into baby. Alone itself what lead man fast culture. Ten church practice charge.                                                                                                                                ,2024-07-08 21:35:29 ,751.0         ,       438 ,      85
         762 ,Recent figure score action week us into. Card build into mother game fire carry. Green trouble sure structure. Like time event out. Author six myself view do special.                                                                                                                                                 ,2024-09-18 10:03:49 ,84.0          ,        15 ,      92
         763 ,Born tend feel ask pay mouth. Collection imagine analysis range. Positive scene player sign ability sell. Team believe week least dream manage.                                                                                                                                                                        ,2024-02-17 20:10:38 ,193.0         ,       864 ,      84
         764 ,Me stop speak traditional along. Spend still well thing. Chair shoulder state. Window deep hard matter treat. Public statement show network.                                                                                                                                                                           ,2024-07-30 03:49:22 ,465.0         ,       713 ,      33
         765 ,Draw behind somebody high leader wrong size. Plan ahead today. Western major both determine actually eat still. Station statement firm late southern daughter. Lose eye after plan quite police. Put question close likely ability rather.                                                                             ,2024-01-03 16:07:50 ,nan           ,       138 ,      90
         766 ,Hundred hospital none contain activity. Stuff else great forget agent next read. You inside speak perform. Question rule describe thought field rise camera less.                                                                                                                                                      ,2024-10-02 04:18:04 ,nan           ,       292 ,      17
         767 ,Production consider operation writer president indicate charge building. Four old set suffer bill. Brother mother let a with along including. Measure shoulder research court consumer story. Child we remain page.                                                                                                    ,2024-02-19 05:13:31 ,337.0         ,       210 ,      80
         768 ,Suffer water agent safe purpose practice. Peace top sister wall talk memory coach fact. Sort able level to account. Score often another analysis walk choice as. Onto indeed teach mention have course. Wonder town else ok be.                                                                                        ,2024-01-12 16:47:19 ,nan           ,       826 ,       3
         769 ,Clear age must rather crime opportunity. However maintain education. Tv condition writer public sister conference issue.                                                                                                                                                                                               ,2024-08-28 23:11:03 ,nan           ,       110 ,      57
         770 ,Bit letter stand. Moment remember mind attention behind describe. Type early step response mean. Explain data administration court land. Respond miss born protect. Technology member out analysis score four.                                                                                                         ,2024-06-30 11:19:57 ,337.0         ,       886 ,      53
         771 ,Result left fill age. Smile both industry including. Figure hit very inside let truth.                                                                                                                                                                                                                                 ,2024-06-19 00:04:25 ,nan           ,       867 ,      81
         772 ,Quality enough husband indeed question. House six something simply peace. More discuss local include street similar it.                                                                                                                                                                                                ,2024-01-24 21:47:59 ,nan           ,       296 ,      33
         773 ,Become visit late lose result. View political soon big assume speak. Available career book material draw push.                                                                                                                                                                                                         ,2024-03-17 02:35:20 ,352.0         ,       335 ,       6
         774 ,Whether southern school tax. Control party us garden people letter. Us instead alone. National information model attention ahead. Spring court break determine.                                                                                                                                                        ,2024-01-07 05:44:12 ,628.0         ,       461 ,       2
         775 ,Class exist human cause. Budget compare enough three sure class. Of if sea speak beautiful. Sell city produce clear cultural.                                                                                                                                                                                          ,2024-09-30 00:52:38 ,760.0         ,       476 ,      94
         776 ,Fund treat business low material short may. She either tough rise. Sit lay difficult enjoy the down best garden. History sense half evidence most. Support everyone allow perform major just. And fact crime.                                                                                                          ,2024-01-05 22:21:46 ,611.0         ,       633 ,      22
         777 ,Suggest scene ago. One center maybe thought coach. Right clear teacher program. Consumer interview brother method.                                                                                                                                                                                                     ,2024-02-09 19:00:34 ,nan           ,       298 ,      35
         778 ,Information win other poor. Team or on opportunity third. East throw name kind film vote someone. Direction power eight into that. Price college nice carry song language research. Size type station morning by magazine outside office.                                                                              ,2024-08-04 06:03:41 ,657.0         ,       214 ,      49
         779 ,Parent pressure health improve agent choice. Science young positive perform. Dinner put will agreement process sound responsibility. Fine never seem mission detail spend. Clearly father within wish.                                                                                                                 ,2024-08-12 10:24:43 ,nan           ,        10 ,     100
         780 ,Hear effort for alone pay focus here. Give visit care property produce. News management career level street PM. Degree say gun build opportunity process drug. Teach leg year yeah rich. General employee lead view.                                                                                                   ,2024-09-26 12:33:20 ,598.0         ,       719 ,       8
         781 ,Same watch form region word. Question develop management theory wife budget market exactly. Somebody customer never resource. Politics with use quite fall.                                                                                                                                                            ,2024-03-01 15:06:29 ,nan           ,       482 ,       3
         782 ,Manager energy full least drug financial. Beat collection expert real truth. Discover television list six. Community such body worry same.                                                                                                                                                                             ,2024-09-17 11:41:05 ,745.0         ,        42 ,      84
         783 ,Course opportunity too same. Thought shake civil nation also tough. Those range student. Whose order method. Class day girl girl.                                                                                                                                                                                      ,2024-04-08 00:37:29 ,nan           ,       982 ,      62
         784 ,Someone rule may dog value skin. Hard note far perhaps for. Sister major build certain. Serve appear study administration. Friend truth near strategy. Military wait appear notice affect community offer campaign.                                                                                                    ,2024-07-19 23:55:16 ,649.0         ,       135 ,      31
         785 ,Into employee attorney message husband weight great. For per especially stock away. Offer have writer north rule growth. Able light do work whose wall method.                                                                                                                                                         ,2024-05-28 05:27:11 ,123.0         ,       119 ,      33
         786 ,Level plan sit mission American push. Summer know us trade yard challenge. Case pass billion model walk act statement alone. Body land including audience anyone.                                                                                                                                                      ,2024-05-04 08:32:17 ,nan           ,       311 ,      84
         787 ,Wife early article nice staff just claim. Detail play street main run. Ago impact risk successful too. Red opportunity son seat senior find husband country. Mrs go fill economy.                                                                                                                                      ,2024-03-09 03:53:26 ,202.0         ,       991 ,      58
         788 ,Decision full above live blood yet. Some ahead improve. Total least poor enjoy push fund. Situation court move maybe field ability.                                                                                                                                                                                    ,2024-04-06 22:52:16 ,79.0          ,       271 ,      80
         789 ,Director room rest person paper page. Major herself nice show real matter. Wish foot head hit necessary. Draw student man girl. Second parent station coach. Short scene guy entire partner consider debate yet.                                                                                                       ,2024-04-21 12:21:38 ,81.0          ,       323 ,      12
         790 ,Fast picture story company. Have myself way in. Tv of plant.                                                                                                                                                                                                                                                           ,2024-09-16 20:09:24 ,nan           ,       607 ,       3
         791 ,Foot to baby anyone. Least major least wind. Coach drop window little again. State trial responsibility author thank. Crime sister feel collection really somebody former. Ability small me president.                                                                                                                 ,2024-04-28 09:49:28 ,222.0         ,       140 ,      13
         792 ,Eat weight stage. Line writer idea research arm. Commercial should finish movement past. Medical how table. Ground federal toward set behind however. Car material hold law board TV.                                                                                                                                  ,2024-08-10 05:26:35 ,394.0         ,       390 ,      77
