DiscussionID ,Text                                                                                                                                                                                                                                                                                                                   ,PostDate            ,Parent_Dis_ID ,EmployeeID ,CourseID
        1057 ,Into control choice sister. Image another easy magazine ahead. Ok high friend.                                                                                                                                                                                                                                         ,2024-09-29 13:20:33 ,954.0         ,       236 ,      30
        1058 ,Page seat character kid. Body worry sport explain foreign growth. Office rather fine a. Not major eye way Republican fact foreign.                                                                                                                                                                                     ,2024-08-26 14:44:22 ,nan           ,       973 ,      12
        1059 ,Father impact create certainly then glass. Million stop lot course I wind. That finish lead way.                                                                                                                                                                                                                       ,2024-08-05 21:08:52 ,164.0         ,       911 ,      56
        1060 ,Approach all maintain model court PM. Card activity value perform man if. Chance dream work business war free why. Teacher thus rich hard while room.                                                                                                                                                                  ,2024-03-02 06:37:57 ,nan           ,       288 ,      72
        1061 ,Voice whom feel surface also good morning. Each last describe point around. Crime art political to.                                                                                                                                                                                                                    ,2024-08-28 16:25:14 ,nan           ,       771 ,      30
        1062 ,Simply pull institution sister. Myself direction heart gas week building environment. Save operation answer sure night most. Station become act song street station. Memory least will true hit mean. Character believe population field back play upon.                                                               ,2024-02-11 09:08:26 ,944.0         ,       649 ,      37
        1063 ,Through mention me finally drop. Size window doctor story seek want. Develop knowledge think people customer reflect. Dark doctor vote health receive.                                                                                                                                                                 ,2024-09-25 05:41:43 ,nan           ,       497 ,      18
        1064 ,Series miss tonight building make some. Order start may while reveal hotel. Door him throw explain on.                                                                                                                                                                                                                 ,2024-08-31 04:53:41 ,nan           ,        98 ,      90
        1065 ,Also city focus well. Oil who morning reality industry traditional discuss. Truth young mission enough radio million. Citizen south father its low chance. South ready weight man movie. Cut evidence break decide wonder put.                                                                                         ,2024-01-11 01:42:54 ,795.0         ,       766 ,      50
        1066 ,Any life risk position risk. Lay PM provide executive quality trade. Style manager tree center ok travel collection.                                                                                                                                                                                                   ,2024-04-05 12:59:42 ,nan           ,       543 ,      67
        1067 ,Most serve yeah reach which ok. American goal him. Whole task and. Knowledge book ability. And too character half. Main shake guy past common resource late.                                                                                                                                                           ,2024-02-09 13:47:33 ,nan           ,       122 ,      31
        1068 ,Court major writer have artist economy. Reason success try where break decade. Partner agreement position laugh back themselves. See actually radio even shoulder stock board interest. Music toward suggest section unit force. Base must gas.                                                                        ,2024-01-21 06:25:02 ,nan           ,       865 ,      66
        1069 ,Long develop owner lawyer fast read center meet. Fine always way even room. Deep gas occur approach store Democrat. North wear last data although change. No rate sport writer message process likely.                                                                                                                 ,2024-09-15 13:11:46 ,nan           ,       460 ,      69
        1070 ,Staff Mrs money field. Quite see ever than soldier. International yeah statement skin knowledge right man. Sport guy every face them. Lose modern help ever both.                                                                                                                                                      ,2024-01-18 13:03:17 ,nan           ,       224 ,      93
        1071 ,Exactly sport section finally so detail. Couple conference toward people effort stage. Pick anything enter benefit official item sister prevent.                                                                                                                                                                       ,2024-03-14 12:34:59 ,nan           ,       424 ,      49
        1072 ,City side speak factor car. To get fight try walk medical long. Now old people decide moment someone. War even action deal. Sense after campaign face low care.                                                                                                                                                        ,2024-07-02 08:32:09 ,nan           ,       994 ,      78
        1073 ,Now across ball skill character Mrs. Often pressure thought PM. Write old career already company source. Common PM project involve sort ok. Necessary region data modern set discover green through. Add billion security shake Congress shoulder.                                                                     ,2024-03-20 12:35:41 ,nan           ,       572 ,      53
        1074 ,Together administration everything whose. As first bag value. Sit his story modern movie. Eat your toward believe capital exist. You foreign collection community reality certain.                                                                                                                                     ,2024-06-07 00:26:38 ,218.0         ,       206 ,      92
        1075 ,Ask add yard. Toward thought race red success into carry. Company off various piece eye your focus.                                                                                                                                                                                                                    ,2024-02-14 22:46:54 ,175.0         ,       270 ,      93
        1076 ,Nice everyone not north west often. Other fish international agent. Beat chance move company continue.                                                                                                                                                                                                                 ,2024-01-28 10:43:24 ,nan           ,       772 ,      56
        1077 ,Reduce stage improve likely. Direction reason season staff truth eye card. Stand avoid share author.                                                                                                                                                                                                                   ,2024-09-09 08:26:56 ,nan           ,       282 ,      59
        1078 ,Name floor all reach walk time. Car close fast. South pretty board choice term.                                                                                                                                                                                                                                        ,2024-07-28 02:58:46 ,971.0         ,       891 ,      62
        1079 ,Region as me where. Mouth tonight decade lay thus. Continue seem recently city nor risk spend. Would success conference chair. Hospital indeed possible successful clear. Board seek after culture finally.                                                                                                            ,2024-05-01 02:28:23 ,nan           ,       276 ,      99
        1080 ,You effort season image bill hotel want call. Here star he middle value message base science. Bar forward arm. Learn give face no upon feel sure last.                                                                                                                                                                 ,2024-07-09 22:53:16 ,631.0         ,       117 ,      61
        1081 ,Growth begin door either doctor. Perform sit heavy fine suddenly resource. Themselves huge opportunity Republican. Establish smile maybe prove point call. Personal like behavior try spend mean force. Ten improve wide bit career final.                                                                             ,2024-08-04 05:27:27 ,nan           ,       785 ,       3
        1082 ,Become alone relationship fine because benefit ability. Administration race capital lay hundred together box. Find now hair wide especially possible him.                                                                                                                                                              ,2024-02-02 18:19:01 ,204.0         ,       703 ,      63
        1083 ,Himself boy likely worker. Serious sing dog seek source. Provide born police nor.                                                                                                                                                                                                                                      ,2024-09-27 14:37:51 ,nan           ,       361 ,      67
        1084 ,Receive shoulder idea expect. Conference since woman cause teach south. Serve again hair indeed perhaps threat. Assume only appear clear summer Democrat strong. Old include activity. Grow course wear story expert would research.                                                                                   ,2024-01-10 18:58:11 ,nan           ,       686 ,      71
        1085 ,Act what option thousand seat simple. Law career and. Who federal four pass man including. Somebody its year leg.                                                                                                                                                                                                      ,2024-04-19 09:51:29 ,nan           ,       548 ,       2
        1086 ,Bed trial explain fish father. Guy check its another low situation. Hear thousand knowledge later society science. What activity section buy forward move soon offer.                                                                                                                                                  ,2024-05-10 19:36:38 ,nan           ,        61 ,      30
        1087 ,Thank explain factor notice sister. New better professional difference if understand care. Seat tough share effect. Draw must reason quite last yard pay design. Hour side subject light. Front course between either.                                                                                                 ,2024-06-29 14:46:15 ,552.0         ,       419 ,       5
        1088 ,Five game activity no. Toward view that seek modern how investment. All view pass unit decade. Cover stock arrive. Deep better nearly discuss hit. Son travel anything carry.                                                                                                                                          ,2024-01-25 00:37:08 ,nan           ,       731 ,      39
        1089 ,Item break animal gas particular others. Notice specific maintain price figure. Example face allow condition indicate their story us. Much Mrs film attack. House short office or social.                                                                                                                              ,2024-09-25 03:55:01 ,764.0         ,       696 ,      68
        1090 ,Then entire heart discuss. Question executive Mr civil paper lawyer pay particular. Meeting deep third author author hair. Guess election reveal better both physical.                                                                                                                                                 ,2024-04-23 06:41:12 ,77.0          ,        34 ,      17
        1091 ,Energy produce begin address local direction data sign. Off field citizen. Behavior tell ten these reality possible ability. Inside movement trade office research vote plan. Forward accept boy yes able. Scientist shoulder idea natural.                                                                            ,2024-01-13 08:21:46 ,nan           ,       974 ,      97
        1092 ,Seem body it join. Mouth can wife toward recognize. Green age get read whom thousand data.                                                                                                                                                                                                                             ,2024-06-21 11:05:36 ,339.0         ,       542 ,      69
        1093 ,Security real probably key audience learn. General stuff speak recently really. Contain might TV election film. Above possible hair. Place happen customer four. Tonight way theory against bed.                                                                                                                       ,2024-02-19 18:10:19 ,nan           ,       141 ,      10
        1094 ,Piece quite day less local some heavy eight. Size list think action finally strong American. Agree only certainly long.                                                                                                                                                                                                ,2024-01-28 01:02:26 ,765.0         ,       315 ,      67
        1095 ,Popular too play political own. Some have program since recent. Yet attorney author early particular.                                                                                                                                                                                                                  ,2024-05-10 17:13:15 ,nan           ,       553 ,      16
        1096 ,Past true election pick condition amount. Sometimes job best local analysis moment. Environment soon three financial push join. War response thousand other center professor alone. Not assume war give note hear drive. Understand start red strategy baby listen suggest.                                            ,2024-01-08 06:49:10 ,nan           ,        43 ,      41
        1097 ,Effect reality fall among rise third. Pull yourself officer billion really look region. Help operation mouth instead start. Task hear about important. Staff base relate along. Different unit event true.                                                                                                             ,2024-03-04 13:56:23 ,nan           ,       578 ,      56
        1098 ,Name maintain hospital within expert local magazine. See some night show final. Somebody size today important. Size east peace kitchen.                                                                                                                                                                                ,2024-07-24 00:26:23 ,240.0         ,       470 ,      39
        1099 ,Probably form follow money sort west. What particular no. Structure bring garden school. Nature wear camera note blue. What space life suffer card.                                                                                                                                                                    ,2024-02-28 10:36:15 ,903.0         ,        73 ,      21
        1100 ,Price generation sister course become. Its data window hard listen create skill business. Power argue two expert seven avoid pass. Need ten happen ago use guess fast.                                                                                                                                                 ,2024-04-05 04:49:38 ,nan           ,       119 ,      95
        1101 ,Indicate PM much culture summer prevent. School nor make weight when sign bill theory. Of game their beyond power.                                                                                                                                                                                                     ,2024-03-26 17:07:56 ,nan           ,       864 ,      52
        1102 ,Be single low area might level. Raise for feeling race. No common note doctor available image common technology.                                                                                                                                                                                                       ,2024-07-09 10:31:38 ,241.0         ,       191 ,      57
        1103 ,Begin show what energy season usually when. Science state detail in control. Back wrong attorney drug claim from. Poor those seven local report. Discussion office always analysis suffer into wind evening. Front way want end control evening.                                                                       ,2024-05-01 18:50:40 ,452.0         ,       889 ,      91
        1104 ,School amount visit maybe. Allow ability chair. Camera pretty recognize light right. Between scene fear since side new. His no particular. Student interest seem maybe how evidence vote seat.                                                                                                                         ,2024-05-18 17:54:07 ,340.0         ,       626 ,      24
        1105 ,Difference more as season. Several remain under reason phone single next young. Character media seat medical gun. Future sell discussion event north myself.                                                                                                                                                           ,2024-02-10 10:44:51 ,573.0         ,       814 ,      85
        1106 ,Line fast rise other already run half. Trouble service arm reflect hot sign. Interview imagine read bar. Blue force base. Seat charge wait drop.                                                                                                                                                                       ,2024-07-11 19:45:27 ,nan           ,       533 ,      49
        1107 ,On Democrat improve leg with take. Until responsibility test indeed new. Reach them foot officer level moment. Administration book author girl thought he physical. Main ahead own. Just management bad bad true future well.                                                                                          ,2024-10-02 22:58:31 ,476.0         ,       796 ,      37
        1108 ,Care seven kind yes individual effect debate. Recently reason structure involve. Amount gas PM if ten. Know agency technology two game fill piece hot. Act significant strong analysis big election available.                                                                                                         ,2024-01-15 11:11:36 ,nan           ,       389 ,      23
        1109 ,Visit hospital board involve step human recently week. Place method reduce brother fish. So detail eat represent will whose name. Business author kid will himself fast exist cut. Front sometimes treat reflect.                                                                                                      ,2024-08-10 17:53:08 ,1011.0        ,        38 ,      25
        1110 ,Recent safe clearly at push on upon. Significant production participant sit student race customer. Image often may score media behavior Mr. Job well whole hear. Perform generation represent end reason. Population respond produce measure change become left.                                                       ,2024-06-20 07:09:33 ,954.0         ,       354 ,      99
        1111 ,Understand soldier baby garden item health garden. Everything admit benefit story service score so fear. Model matter question benefit traditional continue. Close certainly accept million. Matter hit reason lead. Democrat small should fly customer.                                                               ,2024-08-14 08:10:52 ,nan           ,       869 ,      70
        1112 ,Edge issue population pull cell argue. Knowledge shoulder business animal side. Artist kid training appear establish. Writer purpose whose like their feel rather. Hit special each day show others.                                                                                                                   ,2024-05-20 22:26:19 ,188.0         ,       499 ,      90
        1113 ,Gun floor because cell. Increase cup for food. Main expect hour program appear. It enjoy friend various.                                                                                                                                                                                                               ,2024-08-29 23:53:31 ,1081.0        ,       789 ,      49
        1114 ,Item produce know change person every. Memory provide cause adult black dinner newspaper. Oil lose effort skill low. Seem support rock campaign. Money cup key although type.                                                                                                                                          ,2024-09-03 02:55:14 ,483.0         ,       450 ,      52
        1115 ,Type per phone side could wish. Thus management ten city word tell current especially. Body often lose carry. Task window that painting nothing. Agree old deal clearly.                                                                                                                                               ,2024-02-22 21:51:54 ,983.0         ,       496 ,      62
        1116 ,Fill Congress to use nothing speech form. Myself like force nature gun kid down personal. Phone between whole wind. Man adult foreign place difference check defense form. Worker cup throughout arm writer.                                                                                                           ,2024-08-23 07:54:30 ,547.0         ,       509 ,      99
        1117 ,Get product member fill price late. Couple allow national. Between claim remember develop. Project anyone professional form ground visit. Push beautiful explain successful somebody about eat.                                                                                                                        ,2024-07-17 22:45:41 ,nan           ,       838 ,      89
        1118 ,When view door local sell class. Board structure society can never. Product research usually before third ago. Resource his response professional. Car friend red foreign word another indicate. Computer address good miss large.                                                                                     ,2024-08-06 01:22:32 ,245.0         ,       776 ,      23
        1119 ,American friend save rather blue himself. Identify must six player let. Since audience sister wall analysis sense. Save natural music. Who subject north clear when public. Listen color everyone likely.                                                                                                              ,2024-01-26 23:43:50 ,595.0         ,       657 ,      35
        1120 ,War bit large blood ability we. Man window one hear back could true energy. Answer which include such knowledge hear. Story blood order. Decade agency guy social offer. Hot agreement start school military similar. Machine whatever federal central structure form.                                                 ,2024-08-31 08:24:48 ,682.0         ,       362 ,      62
        1121 ,Professor meeting could phone across improve it. For cut half detail pay why network. Message beautiful past. Reality suddenly wonder front. Painting mention method cover. Kind others suffer gun agency page not.                                                                                                    ,2024-04-27 07:06:05 ,680.0         ,       924 ,      72
        1122 ,Human if together affect surface agency certain garden. Maintain dream no other why take. Economic half speak writer former win attorney. Thank public side large for control send.                                                                                                                                    ,2024-09-12 03:22:28 ,711.0         ,       285 ,      25
